{
  "$schema": "https://json-schema.org/draft/2020-12/schema",
  "$id": "https://github.com/kimlage/crypto-edge-search/schemas/trial-ledger.schema.json",
  "title": "TrialLedger",
  "description": "The cross-run ledger of every distinct config evaluated in a campaign. The honest N the Deflated Sharpe must deflate by is the number of DISTINCT configs (unique DNA / trial ids) searched — not 1, not the per-family series length. Each entry records a config fingerprint, its score, and its verdict, so the deflation N is auditable and a searched grid can never be deflated by 1.",
  "type": "object",
  "additionalProperties": false,
  "required": ["campaignId", "trialCount", "entries"],
  "properties": {
    "campaignId": {
      "type": "string",
      "minLength": 1,
      "description": "Identifier for the campaign / domain this ledger covers."
    },
    "trialCount": {
      "type": "integer",
      "minimum": 1,
      "description": "Distinct configs evaluated = count of unique config fingerprints in entries. This is the honest N injected into the DSR. Never below 1."
    },
    "entries": {
      "type": "array",
      "minItems": 1,
      "description": "One row per distinct config evaluated.",
      "items": {
        "type": "object",
        "additionalProperties": false,
        "required": ["configId", "score"],
        "properties": {
          "configId": {
            "type": "string",
            "minLength": 1,
            "description": "Stable config fingerprint (prefer DNA id; fall back to trial id). The distinct-count key."
          },
          "dnaId": {
            "type": ["string", "null"],
            "description": "Genotype id actually searched, when available."
          },
          "trialId": {
            "type": ["string", "null"],
            "description": "Trial id fallback fingerprint when no DNA id exists."
          },
          "statistic": {
            "type": "string",
            "enum": ["compoundReturn", "mean", "sharpe"],
            "description": "Which return-series statistic the score is scored on."
          },
          "score": {
            "type": "number",
            "description": "In-sample score for this config under the chosen statistic."
          },
          "isGridBest": {
            "type": "boolean",
            "description": "True for the single grid-best config selected out of the search."
          },
          "verdict": {
            "type": "string",
            "enum": ["SURVIVE", "PROMISING", "KILL", "DEFERRED", "INDETERMINATE"],
            "description": "Per-config verdict, if a full gauntlet was run on it."
          }
        }
      }
    },
    "createdAt": {
      "type": "string",
      "format": "date-time",
      "description": "ISO-8601 timestamp the ledger was finalized."
    }
  }
}
